{
  "$schema": "https://json-schema.org/draft/2020-12/schema",
  "$id": "ia-cave-a-vin/contrat-n8n/requete-enrichissement.schema.json",
  "title": "POST /enrichissement : corps de la requête",
  "description": "Envoyé par l'app au flux n8n. Les photos sont déjà compressées sur le téléphone (1 500 px côté long, JPEG qualité 80).",
  "type": "object",
  "additionalProperties": false,
  "required": ["version_contrat", "request_id", "photos", "langue", "date_client"],
  "properties": {
    "version_contrat": { "type": "string", "pattern": "^1\\.[0-9]+$" },
    "request_id": {
      "type": "string",
      "format": "uuid",
      "description": "Généré par l'app. Un second envoi avec le même request_id renvoie le job existant (idempotence)."
    },
    "fiche_id": { "type": "string", "format": "uuid", "description": "Fiche locale à enrichir, renvoyée telle quelle." },
    "photos": {
      "type": "array",
      "minItems": 1,
      "maxItems": 4,
      "items": {
        "type": "object",
        "additionalProperties": false,
        "required": ["index", "type_photo", "mime", "base64"],
        "properties": {
          "index": { "type": "integer", "minimum": 0, "maximum": 3 },
          "type_photo": { "enum": ["etiquette", "contre_etiquette", "capsule", "collerette", "autre"] },
          "mime": { "enum": ["image/jpeg", "image/webp"] },
          "base64": {
            "type": "string",
            "contentEncoding": "base64",
            "maxLength": 2800000,
            "description": "2 Mo au plus une fois décodé."
          }
        }
      }
    },
    "indices": {
      "type": "object",
      "additionalProperties": false,
      "description": "Ce que l'utilisateur a déjà saisi ou scanné. Facultatif.",
      "properties": {
        "ean": { "type": "string", "pattern": "^[0-9]{13}$" },
        "texte_libre": { "type": "string", "maxLength": 200 },
        "millesime": { "oneOf": [{ "type": "integer", "minimum": 1900, "maximum": 2100 }, { "const": "NM" }] },
        "format_cl": { "type": "number", "exclusiveMinimum": 0 }
      }
    },
    "champs_verrouilles": {
      "type": "array",
      "uniqueItems": true,
      "items": { "type": "string" },
      "description": "Champs saisis à la main que l'agent ne doit pas proposer de modifier (noms du contrat)."
    },
    "inclure_prix": {
      "type": "boolean",
      "default": true,
      "description": "Lancer aussi la recherche de prix dans le même job."
    },
    "langue": { "const": "fr" },
    "date_client": { "type": "string", "format": "date" }
  }
}
