{
  "version_contrat": "1.1",
  "request_id": "5d0c1c9e-8a3f-4f6e-9c2b-1a7e3d4f5b60",
  "fiche_id": "0b8f7e2a-4c1d-4a9b-8e3f-2d6c5b4a3f10",
  "photos": [
    { "index": 0, "type_photo": "etiquette", "mime": "image/jpeg", "base64": "/9j/4AAQSkZJRgABAQAAAQABAAD/2wBDAAgGBgcGBQgHBwcJCQgKDBQNDAsLDBkSEw8U" },
    { "index": 1, "type_photo": "contre_etiquette", "mime": "image/jpeg", "base64": "/9j/4AAQSkZJRgABAQAAAQABAAD/2wBDAAgGBgcGBQgHBwcJCQgKDBQNDAsLDBkSEw8U" }
  ],
  "indices": { "format_cl": 75 },
  "champs_verrouilles": [],
  "inclure_prix": true,
  "langue": "fr",
  "date_client": "2026-10-20"
}
